{"mode": "major", "source": {"id": "01hzyinst00000000000000001", "engine": "postgres"}, "target": {"id": "01hzyinst00000000000000002", "engine": "postgres"}, "databases": [{"name": "shop", "owner": "app"}], "users": [{"username": "shop", "password": "u-s3cret", "grants": [{"database": "shop", "privileges": ["ALL PRIVILEGES"]}]}], "network": "falak-env-01hzyenv000000000000000001", "alias": "falak-db-01hzyinst00000000000000001"}
